post_id,target_username,author_username,created_at_jst,post_date_jst,tweet_url,text
2043839113590452567,not_zerosumgame,not_zerosumgame,2026-04-14 08:49:52,2026-04-14,https://x.com/not_zerosumgame/status/2043839113590452567,「エネルギー施設復旧に2年」　IEA事務局長、中東巡り（共同通信） - Yahoo!ニュース https://t.co/YbK336tORg
2043849573756723317,not_zerosumgame,not_zerosumgame,2026-04-14 09:31:25,2026-04-14,https://x.com/not_zerosumgame/status/2043849573756723317,パナソニックのユニットバスも上位モデルは受注制限かかりましたー
2043849898760753310,not_zerosumgame,not_zerosumgame,2026-04-14 09:32:43,2026-04-14,https://x.com/not_zerosumgame/status/2043849898760753310,実業ダメージ受けている方だらけで、投資家しか豊かになってない
2043851844796199323,not_zerosumgame,not_zerosumgame,2026-04-14 09:40:27,2026-04-14,https://x.com/not_zerosumgame/status/2043851844796199323,"日本では歴史上最大のコストアップが今年きてるので、原価高騰影響は本当にやばい。
そもそも、何故あんなにも安く建物を建てられたのだろうか状態ではある

非リゾート離島やインフラの乏しいエリアは地元の工事もなくなるかと思う。

それと対になる都心部では賃料大幅上昇させるオーナーが急増する https://t.co/0Q8xveHp6V"
2043853924114030716,not_zerosumgame,not_zerosumgame,2026-04-14 09:48:43,2026-04-14,https://x.com/not_zerosumgame/status/2043853924114030716,レバ掛けて調整局面のドン底で売るしか無くなった人がまた無闇にレバ掛けていたりしないかな。初めての経験じゃないはずなのに、同じ失敗を繰り返していないだろうか
2043854866351829433,not_zerosumgame,not_zerosumgame,2026-04-14 09:52:27,2026-04-14,https://x.com/not_zerosumgame/status/2043854866351829433,普段から取れてない人が不利な立ち回りになっているのに次は取れると思ってしまうのは考えてなさすぎる https://t.co/dLXQgnFsDs
2043856723237318947,not_zerosumgame,not_zerosumgame,2026-04-14 09:59:50,2026-04-14,https://x.com/not_zerosumgame/status/2043856723237318947,ユニチカ株でCF改善の事業者 https://t.co/29cb7jgUgI https://t.co/2MOliXOlEw
2043859170424959451,not_zerosumgame,not_zerosumgame,2026-04-14 10:09:33,2026-04-14,https://x.com/not_zerosumgame/status/2043859170424959451,究極のエコカー｢燃料電池車｣はオワコンなのか？ ｢水素の社会実装をリードする｣と言うトヨタの戦略 | 桃田健史の「クルマとエネルギー」の未来 | 東洋経済オンライン https://t.co/XqK3uicn6d
2043861705470685645,not_zerosumgame,not_zerosumgame,2026-04-14 10:19:38,2026-04-14,https://x.com/not_zerosumgame/status/2043861705470685645,高市首相と片山財務相が赤沢経産相に金融政策の発言を控えるよう注意 - Bloomberg https://t.co/vHeGrbAqTX
2043861845149397049,not_zerosumgame,not_zerosumgame,2026-04-14 10:20:11,2026-04-14,https://x.com/not_zerosumgame/status/2043861845149397049,政府の円安是正ネタバレをするなと怒られた赤沢さん https://t.co/1om8r8drVE
2043862739647660112,not_zerosumgame,not_zerosumgame,2026-04-14 10:23:44,2026-04-14,https://x.com/not_zerosumgame/status/2043862739647660112,築浅物件を一棟区分関係なく、下限からそこそこな数同時に買付入れていくことにした
2043867791426760737,not_zerosumgame,not_zerosumgame,2026-04-14 10:43:49,2026-04-14,https://x.com/not_zerosumgame/status/2043867791426760737,"大阪市中心6区はそもそも実需の供給がかなり少ないのと新築も15F建板状で次から450万円前後〜の世界なので、中古の築浅ファミリータイプの400万円以下根こそぎ買ったらいきなり相場が上がってしまいます。
それを、今ファンドとデベロッパー本体+子会社がやってます"
2043869456309596213,not_zerosumgame,not_zerosumgame,2026-04-14 10:50:26,2026-04-14,https://x.com/not_zerosumgame/status/2043869456309596213,代理店が一気に注文しすぎです https://t.co/8eZ8NZsjrN
2043871498545590656,not_zerosumgame,not_zerosumgame,2026-04-14 10:58:33,2026-04-14,https://x.com/not_zerosumgame/status/2043871498545590656,"ユニットバス問題なんかでパニックになる日本てちょっとおかしいと思う。

紐解いていけば想像できる話なのに、メディアやSNSで目立ってから表面的に捉えてパニックになる人が多すぎるじゃ効かないくらいいる https://t.co/PaKgvbHpF9"
2043874796237431190,not_zerosumgame,not_zerosumgame,2026-04-14 11:11:39,2026-04-14,https://x.com/not_zerosumgame/status/2043874796237431190,大阪市内ならどこでもいいねん。とりあえずマンション買えたらいいねん。という人は、安治川口か我孫子の駅徒歩10分以上とか安いし、競争少ないから全然買えるよ。旭区も竣工在庫なると思うから価格は上げてこないはず
2043875694653124727,not_zerosumgame,not_zerosumgame,2026-04-14 11:15:13,2026-04-14,https://x.com/not_zerosumgame/status/2043875694653124727,都心選択肢を捨てるだけで新築でも中古でも全然買える https://t.co/ttO5ZDxorA
2043878488139292775,not_zerosumgame,not_zerosumgame,2026-04-14 11:26:19,2026-04-14,https://x.com/not_zerosumgame/status/2043878488139292775,江戸バース臭漂うプロジェクトきた https://t.co/6pGivmdtcI
2043881061768409179,not_zerosumgame,not_zerosumgame,2026-04-14 11:36:33,2026-04-14,https://x.com/not_zerosumgame/status/2043881061768409179,ノーチラス50周年どうしましょうか？って電話かかってきたけど、2000本て作りすぎじゃない？被りそう
2043882734809165957,not_zerosumgame,not_zerosumgame,2026-04-14 11:43:12,2026-04-14,https://x.com/not_zerosumgame/status/2043882734809165957,"先日のAPの新作お披露目会で実物見て刺さったのは、このエクストラシンとcode

しかし、とんでもないロイヤルオークコンセプトのレインボーゴリ押しされた

ターコイズのcodeはパーペが世界30本とかだったよね？ https://t.co/0K9ZV77TYo"
2043885349588611413,not_zerosumgame,not_zerosumgame,2026-04-14 11:53:35,2026-04-14,https://x.com/not_zerosumgame/status/2043885349588611413,定期借地権マンション供給2.7倍　「残り35年で価値ピーク」説も：日本経済新聞 https://t.co/oWHz4GMIWM
2043886202034761816,not_zerosumgame,not_zerosumgame,2026-04-14 11:56:58,2026-04-14,https://x.com/not_zerosumgame/status/2043886202034761816,「残存35年になったあたりで価格が下落傾向になるようだ」と指摘する。残存35年を切ると35年の住宅ローンを組んでの購入がしづらくなるため、新たな買い手がつきにくくなることが背景にあるとみられる。 https://t.co/2AG5OWbJPy
2043886703396733092,not_zerosumgame,not_zerosumgame,2026-04-14 11:58:58,2026-04-14,https://x.com/not_zerosumgame/status/2043886703396733092,おい。これ半値に見えるけど価格改定後で仕入れ価格の倍だぞ。 https://t.co/CM7XusVo9x
2043888518548906373,not_zerosumgame,not_zerosumgame,2026-04-14 12:06:11,2026-04-14,https://x.com/not_zerosumgame/status/2043888518548906373,偽の情報流していることをリークされてるんだから、情報漏洩者川上だろ https://t.co/KBl3J1plTb
2043893952093532512,not_zerosumgame,not_zerosumgame,2026-04-14 12:27:46,2026-04-14,https://x.com/not_zerosumgame/status/2043893952093532512,気が付いたら今日全然アイコス吸ってなかった。吸わないと
2043894541049311740,not_zerosumgame,not_zerosumgame,2026-04-14 12:30:06,2026-04-14,https://x.com/not_zerosumgame/status/2043894541049311740,今年初めて日興証券見たら、なぜか湖北工業あった
